category,question,answer
colleges,how many colleges are there in udst,"UDST has five colleges:
College of Business
College of Computing and Information Technology
College of Engineering and Technology
College of Health Sciences
College of General Education"

colleges,what colleges are in udst,"UDST has five colleges:
College of Business
College of Computing and Information Technology
College of Engineering and Technology
College of Health Sciences
College of General Education"

colleges,list the colleges at udst,"UDST has five colleges:
College of Business
College of Computing and Information Technology
College of Engineering and Technology
College of Health Sciences
College of General Education"

colleges,what faculties exist at udst,"UDST has five colleges:
College of Business
College of Computing and Information Technology
College of Engineering and Technology
College of Health Sciences
College of General Education"

colleges,what schools does udst have,"UDST has five colleges:
College of Business
College of Computing and Information Technology
College of Engineering and Technology
College of Health Sciences
College of General Education"

colleges,does udst have a computing college,"Yes. UDST has the College of Computing and Information Technology."

colleges,does udst have a business college,"Yes. UDST has the College of Business."

colleges,does udst have an engineering college,"Yes. UDST has the College of Engineering and Technology."

colleges,does udst have a health sciences college,"Yes. UDST has the College of Health Sciences."

colleges,which college offers computing programs,"Computing programs are offered by the College of Computing and Information Technology."

colleges,which college offers engineering programs,"Engineering programs are offered by the College of Engineering and Technology."

colleges,which college offers business programs,"Business programs are offered by the College of Business."

colleges,which college offers healthcare programs,"Healthcare programs are offered by the College of Health Sciences."

programs,what programs are offered at udst,"UDST offers programs in the following colleges:

College of Computing and Information Technology
Data Science and Artificial Intelligence
Software Engineering
Information Technology
Information Systems
Cyber Security

College of Business
Accounting
Digital Marketing
Banking and Financial Technology
Human Resource Management
Logistics and Supply Chain Management

College of Engineering and Technology
Construction Engineering
Aeronautical Engineering
Telecommunications Engineering
Chemical Processing Engineering

College of Health Sciences
Nursing
Dental Hygiene
Environmental Health
Critical Care Paramedicine"

programs,what can i study at udst,"Students at UDST can study programs in computing, business, engineering, and health sciences."

programs,what majors are available at udst,"UDST offers programs in computing, business, engineering, and health sciences."

programs,what fields can i study at udst,"Students can study programs in computing, engineering, business, and health sciences."

programs,what degrees does udst offer,"UDST offers diploma, bachelor, and master programs."

programs,does udst offer diploma programs,"Yes. UDST offers diploma programs in computing, business, engineering technology, and health sciences."

programs,does udst offer bachelor programs,"Yes. UDST offers bachelor programs in computing, business, engineering, and health sciences."

programs,does udst offer master programs,"Yes. UDST offers master programs such as:
Master in Data Science and Artificial Intelligence
Master in Engineering Management"

programs,what computing programs are offered at udst,"The College of Computing and Information Technology offers:

Data Science and Artificial Intelligence
Software Engineering
Information Technology
Information Systems
Cyber Security"

programs,what programs are in the computing college,"The College of Computing and Information Technology offers:

Data Science and Artificial Intelligence
Software Engineering
Information Technology
Information Systems
Cyber Security"

programs,what programs are in the it college,"The College of Computing and Information Technology offers:

Data Science and Artificial Intelligence
Software Engineering
Information Technology
Information Systems
Cyber Security"

programs,what it programs does udst have,"The College of Computing and Information Technology offers:

Data Science and Artificial Intelligence
Software Engineering
Information Technology
Information Systems
Cyber Security"

programs,what information technology programs does udst have,"The College of Computing and Information Technology offers:

Data Science and Artificial Intelligence
Software Engineering
Information Technology
Information Systems
Cyber Security"

programs,what programs does the it college have,"The College of Computing and Information Technology offers:

Data Science and Artificial Intelligence
Software Engineering
Information Technology
Information Systems
Cyber Security"

programs,does udst offer data science,"Yes. UDST offers the Data Science and Artificial Intelligence program."

programs,is there an artificial intelligence program at udst,"Yes. UDST offers the Data Science and Artificial Intelligence program."

programs,does udst offer software engineering,"Yes. UDST offers the Software Engineering program."

programs,is there a software engineering program,"Yes. UDST offers the Software Engineering program."

programs,is there a software engineering program at udst,"Yes. UDST offers the Software Engineering program."

programs,can i study software engineering at udst,"Yes. UDST offers the Software Engineering program."

programs,does udst offer information technology,"Yes. UDST offers Information Technology programs."

programs,does udst offer cyber security,"Yes. UDST offers Cyber Security related programs."

programs,what business programs are available at udst,"The College of Business offers:

Accounting
Digital Marketing
Banking and Financial Technology
Human Resource Management
Logistics and Supply Chain Management"

programs,does udst offer accounting,"Yes. UDST offers Accounting programs."

programs,does udst offer digital marketing,"Yes. UDST offers Digital Marketing programs."

programs,does udst offer logistics programs,"Yes. UDST offers Logistics and Supply Chain Management programs."

programs,what engineering programs are available,"The College of Engineering and Technology offers:

Construction Engineering
Aeronautical Engineering
Telecommunications Engineering
Chemical Processing Engineering"

programs,does udst offer aeronautical engineering,"Yes. UDST offers Aeronautical Engineering programs."

programs,does udst offer telecommunications engineering,"Yes. UDST offers Telecommunications Engineering programs."

programs,does udst offer chemical processing engineering,"Yes. UDST offers Chemical Processing Engineering programs."

programs,what health sciences programs are offered,"The College of Health Sciences offers:

Nursing
Dental Hygiene
Environmental Health
Critical Care Paramedicine"

programs,does udst offer nursing,"Yes. UDST offers Nursing programs."

programs,does udst offer dental hygiene,"Yes. UDST offers Dental Hygiene programs."

programs,does udst offer environmental health programs,"Yes. UDST offers Environmental Health programs."

programs,does udst offer paramedicine programs,"Yes. UDST offers Critical Care Paramedicine programs."
programs,udst programs,"UDST offers programs in the following colleges:

College of Computing and Information Technology
Data Science and Artificial Intelligence
Software Engineering
Information Technology
Information Systems
Cyber Security

College of Business
Accounting
Digital Marketing
Banking and Financial Technology
Human Resource Management
Logistics and Supply Chain Management

College of Engineering and Technology
Construction Engineering
Aeronautical Engineering
Telecommunications Engineering
Chemical Processing Engineering

College of Health Sciences
Nursing
Dental Hygiene
Environmental Health
Critical Care Paramedicine"

programs,what programs does udst have,"UDST offers programs in the following colleges:

College of Computing and Information Technology
Data Science and Artificial Intelligence
Software Engineering
Information Technology
Information Systems
Cyber Security

College of Business
Accounting
Digital Marketing
Banking and Financial Technology
Human Resource Management
Logistics and Supply Chain Management

College of Engineering and Technology
Construction Engineering
Aeronautical Engineering
Telecommunications Engineering
Chemical Processing Engineering

College of Health Sciences
Nursing
Dental Hygiene
Environmental Health
Critical Care Paramedicine"

programs,what engineering programs does udst offer,"The College of Engineering and Technology offers:

Construction Engineering
Aeronautical Engineering
Telecommunications Engineering
Chemical Processing Engineering"

programs,what majors are available for students at udst,"UDST offers programs in computing, business, engineering, and health sciences."

programs,available majors at udst,"UDST offers programs in computing, business, engineering, and health sciences."

programs,can i get a diploma from udst,"Yes. UDST offers diploma programs in computing, business, engineering technology, and health sciences."

programs,can students get a diploma from udst,"Yes. UDST offers diploma programs in computing, business, engineering technology, and health sciences."

about_udst,what is udst,"UDST stands for the University of Doha for Science and Technology. It is a public university in Qatar specializing in applied, technical, and professional education."

about_udst,what does udst stand for,"UDST stands for the University of Doha for Science and Technology."

about_udst,tell me about udst,"The University of Doha for Science and Technology (UDST) is a public university in Qatar offering diploma, bachelor, and master programs in applied and technical fields."

about_udst,what kind of university is udst,"UDST is a public university in Qatar that focuses on applied education, technology, engineering, business, and health sciences."

about_udst,is udst a public university,"Yes. UDST is a public university in Qatar."

about_udst,where is udst located,"The University of Doha for Science and Technology is located in Doha, Qatar."

about_udst,which country is udst in,"UDST is located in Doha, Qatar."

about_udst,what is udst known for,"UDST is known for applied and technical education and offers diploma, bachelor, and master programs in several professional fields."

about_udst,why should students study at udst,"Students choose UDST because it offers practical education, modern facilities, and programs aligned with industry needs."

about_udst,why choose udst,"UDST offers applied learning, modern facilities, and programs designed to prepare students for real-world careers."

about_udst,how many colleges does udst have,"UDST has five colleges:
College of Business
College of Computing and Information Technology
College of Engineering and Technology
College of Health Sciences
College of General Education"

about_udst,how many programs does udst offer,"UDST offers many diploma, bachelor, and master programs across its colleges."

about_udst,what can students study at udst,"Students at UDST can study programs in computing, business, engineering, and health sciences."

about_udst,what majors are available at udst,"UDST offers majors in computing, engineering, business, and health sciences."

about_udst,what degrees does udst offer,"UDST offers diploma, bachelor, and master programs."

about_udst,does udst have a campus,"Yes. UDST has a modern campus located in Doha, Qatar."

about_udst,what facilities are available at udst,"UDST provides facilities such as classrooms, laboratories, a library, student services, and sports and wellness facilities."

about_udst,does udst have a library,"Yes. UDST has a library that provides academic resources for students."

about_udst,is there a library at udst,"Yes. UDST provides library services for students and faculty."

about_udst,does udst provide a campus map,"Yes. UDST provides a campus map on its official website to help students locate buildings and services."

about_udst,where can i find the udst campus map,"The campus map is available on the official UDST website."

about_udst,what student services does udst offer,"UDST provides several student services including Student Central Services, counseling and accessibility services, library support, and sports and wellness services."

about_udst,does udst provide student support,"Yes. UDST provides student support services to assist students during their studies."

about_udst,does udst offer counseling services,"Yes. UDST offers student counseling and support services."

about_udst,what is student central services,"Student Central Services at UDST helps students with academic support, registration, and general inquiries."

about_udst,where can students get help at udst,"Students can get help through Student Central Services and other support services provided by the university."

about_udst,what is student life like at udst,"Student life at UDST includes academic learning, student activities, sports programs, and support services."

about_udst,does udst have student activities,"Yes. UDST provides student activities and events that support student engagement."

about_udst,does udst have sports facilities,"Yes. UDST offers sport and wellness facilities for students."

about_udst,does udst offer sports and wellness programs,"Yes. UDST offers sports and wellness programs for students."

about_udst,how can i apply to udst,"Students can apply to UDST through the admissions section on the official UDST website."

about_udst,where can i find admissions information,"Admissions information is available on the official UDST website."

about_udst,does udst have an admissions page,"Yes. UDST provides admissions information on its official website."

about_udst,where can i see udst programs,"Students can see all UDST programs on the official UDST website."

about_udst,where can i find the list of programs at udst,"The list of programs is available on the official UDST website."

about_udst,where can i learn more about udst,"You can learn more about UDST by visiting the official website: https://www.udst.edu.qa"

about_udst,what is the official udst website,"The official website of the University of Doha for Science and Technology is https://www.udst.edu.qa"

about_udst,does udst have an official website,"Yes. The official UDST website is https://www.udst.edu.qa"

about_udst,where can i read about udst,"You can read about UDST on the official website: https://www.udst.edu.qa"

about_udst,udst information,"UDST is a public university in Qatar offering applied education and professional programs."

about_udst,udst university info,"UDST is the University of Doha for Science and Technology, a public university in Qatar."

about_udst,about udst,"UDST is a public university in Doha, Qatar that provides applied and technical education in several academic fields."

about_udst,information about udst,"UDST offers diploma, bachelor, and master programs in computing, engineering, business, and health sciences."

about_udst,udst overview,"UDST is a modern university in Qatar offering applied education and professional programs."

about_udst,who is the president of udst,"The President of the University of Doha for Science and Technology is Dr. Salem Al-Naemi."

about_udst,who is udst president,"The President of the University of Doha for Science and Technology is Dr. Salem Al-Naemi."

about_udst,name of udst president,"The President of the University of Doha for Science and Technology is Dr. Salem Al-Naemi."

about_udst,who leads udst,"UDST is led by its President, Dr. Salem Al-Naemi."